"Boehm, Serena, male, orange, 01-10-1954"
Lowe | Vito | male | orange | 04-30-1973
Bosco Delaney female orange 12-09-1962
"Bruen, Georgianna, male, orange, 05-29-1970"
Hudson | Sonny | male | green | 07-17-1968
Hermiston Beverly female yellow 06-06-1993
"Olson, Jaylon, male, green, 02-28-1968"
Goldner | Luella | male | blue | 05-28-1976
Abernathy Noelia male green 12-22-1963
"Wisoky, Osbaldo, male, blue, 04-01-1961"
Klein | Herta | female | blue | 05-24-1954
Langworth Ofelia male orange 08-09-1965
"Christiansen, Vallie, male, green, 05-29-1996"
Nitzsche | Eladio | female | orange | 07-06-1973
Ratke Ryann male green 05-08-1989
"Bailey, Lucinda, male, green, 01-29-1974"
Okuneva | Lacy | male | orange | 12-30-1962
D'Amore Zelda female green 12-07-1962
"Stamm, Catharine, female, orange, 06-05-1978"
Lubowitz | Destiny | male | orange | 12-19-1966
Lebsack Lera female blue 03-27-1959
"Harvey, Bianka, female, blue, 04-10-1964"
Turner | Reva | male | green | 09-16-1981
Hane Marcelino female blue 03-21-1988
"Braun, Alfonso, male, blue, 04-08-1979"
Orn | Armando | male | green | 05-20-1960
Dooley Eula female orange 01-29-1990
"Spencer, Nico, female, orange, 07-07-1957"
Monahan | Donnie | female | blue | 02-07-1979
Brekke Glenda male blue 08-23-1987
