"Hegmann, Kian, female, yellow, 06/02/1961"
McKenzie | Emmanuelle | female | orange | 05/29/1952
McClure Malinda male red 12/27/1984
"Boyle, Aisha, female, orange, 12/21/1978"
Wilderman | Joesph | female | blue | 05/22/1975
Erdman Douglas female yellow 09/19/1986
"Bruen, Jaiden, female, yellow, 09/06/1982"
Champlin | Sedrick | male | red | 02/24/1988
Rolfson Conrad male red 08/10/1973
"Schulist, Titus, female, orange, 12/21/1964"
Sporer | Giuseppe | female | green | 11/07/1953
Brekke Micheal female yellow 01/04/1980
"Halvorson, Mortimer, female, red, 07/19/1981"
Kulas | Susana | female | red | 12/17/1953
Armstrong Maximilian female yellow 10/23/1965
"Blick, Adelbert, male, yellow, 04/25/1969"
Kub | Dusty | male | yellow | 03/22/1969
Hettinger Sammie male green 08/25/1996
"Jakubowski, Gretchen, male, red, 05/22/1992"
Gleichner | Tyshawn | female | blue | 06/16/1989
Kessler Carey male yellow 07/04/1990
"Wolff, Noemi, female, red, 12/10/1969"
Daugherty | Katheryn | female | orange | 07/29/1963
Daniel Edward male orange 01/25/1951
"Langworth, Imogene, female, yellow, 11/03/1981"
Baumbach | Frederic | male | orange | 07/12/1984
Reichel Gerardo female green 10/09/1985
"Watsica, Jaren, male, orange, 11/30/1960"
Stroman | Katlynn | female | blue | 01/17/1985
Heller Uriel female orange 08/13/1988
